{
  "repo_id": "marimo-team__marimo",
  "commit": "979fe6a82ebfbc151de8a59461de5cfafe61db78",
  "lora_id": "ui_outputs_interactivity_1",
  "document_id": "ui_outputs_interactivity_1",
  "topic": "UI, Outputs, and Interactivity",
  "topic_slug": "ui_outputs_interactivity",
  "generator": "codex_subagents_v1",
  "prompt_version": "ledger_example_question_generation_v1",
  "example_questions": [
    "How do marimo UI elements send updated values from the browser back to Python?",
    "How does marimo decide what visual output appears for a cell in app view?",
    "How can I embed a marimo slider or other UI element inside markdown?",
    "What is the difference between console output and visual cell output in marimo?",
    "How does marimo turn ordinary Python objects into rich output HTML?"
  ]
}
