{
  "repo_id": "marimo-team__marimo",
  "commit": "979fe6a82ebfbc151de8a59461de5cfafe61db78",
  "lora_id": "reactive_runtime_dataflow_1",
  "document_id": "reactive_runtime_dataflow_1",
  "topic": "Reactive Runtime and Dataflow",
  "topic_slug": "reactive_runtime_dataflow",
  "generator": "codex_subagents_v1",
  "prompt_version": "ledger_example_question_generation_v1",
  "example_questions": [
    "How does marimo decide which cells become stale after a cell changes?",
    "What responsibilities does DirectedGraph have in marimo's reactive runtime?",
    "How are disabled cells handled during reactive execution?",
    "What does marimo's dependencies panel reveal about notebook dataflow?"
  ]
}
