{
  "repo_id": "pytest-dev__pytest",
  "commit": "5dfd4eab7d328266fb3788dcbb031c9d67903daf",
  "lora_id": "public_api_interface_1",
  "document_id": "public_api_interface_1",
  "topic": "Public API Interface",
  "topic_slug": "public_api_interface",
  "generator": "codex_subagents_v1",
  "prompt_version": "ledger_example_question_generation_v1",
  "example_questions": [
    "How does pytest expose internal helpers through the public pytest namespace?",
    "What public pytest helpers raise dedicated outcome exceptions for fail, skip, xfail, and exit?",
    "How does pytest.warns record, validate, and re-emit warnings from a test block?",
    "What is the role of the recwarn fixture in pytest's public warning API?",
    "How does pytest's public exception-group assertion helper differ from a simple containment check?"
  ]
}
