{
  "repo_id": "fogleman__Craft",
  "commit": "d6888a6e1e54340358ce25b1220f410541360b6b",
  "lora_id": "rendering_graphics_pipeline_1",
  "document_id": "rendering_graphics_pipeline_1",
  "topic": "Rendering and Graphics Pipeline",
  "topic_slug": "rendering_graphics_pipeline",
  "generator": "codex_subagents_v1",
  "prompt_version": "ledger_example_question_generation_v1",
  "example_questions": [
    "How does Craft organize its OpenGL shader programs and texture units for blocks, text, signs, and the sky?",
    "What does Craft store in block and plant vertex buffers before drawing them?",
    "How does the rendering path decide which chunks are visible enough to draw?",
    "How are magenta texture pixels handled for glass, plants, and other cutout geometry?",
    "What role do the matrix helpers play when rendering the world, HUD, item preview, and picture-in-picture view?"
  ]
}
