{
  "repo_id": "pytest-dev__pytest",
  "commit": "5dfd4eab7d328266fb3788dcbb031c9d67903daf",
  "lora_id": "assertions_warnings_outcomes_1",
  "document_id": "assertions_warnings_outcomes_1",
  "topic": "Assertions, Warnings, and Outcomes",
  "topic_slug": "assertions_warnings_outcomes",
  "generator": "codex_subagents_v1",
  "prompt_version": "ledger_example_question_generation_v1",
  "example_questions": [
    "How does pytest produce detailed failure output from normal Python assert statements?",
    "What assertion comparison details does pytest add for strings, sequences, sets, and dictionaries?",
    "How are warning filters from configuration, command-line options, and marks applied during a pytest run?",
    "When should a test use pytest.importorskip instead of a skip marker?",
    "How do pytest's fail, skip, xfail, and exit helpers communicate outcomes internally?"
  ]
}
