{
  "repo_id": "pytest-dev__pytest",
  "commit": "5dfd4eab7d328266fb3788dcbb031c9d67903daf",
  "lora_id": "runtime_reporting_io_1",
  "document_id": "runtime_reporting_io_1",
  "topic": "Runtime, Reporting, and IO Helpers",
  "topic_slug": "runtime_reporting_io",
  "generator": "codex_subagents_v1",
  "prompt_version": "ledger_example_question_generation_v1",
  "example_questions": [
    "How does pytest update PYTEST_CURRENT_TEST while a test item is running?",
    "What information do pytest report objects expose for captured output and long failure text?",
    "How does TerminalReporter choose between compact progress letters and verbose per-test output?",
    "Where does pytest collect timing data for the slowest durations summary?",
    "How does tmp_path_factory choose and manage the base temporary directory?"
  ]
}
