{
  "repo_id": "pytest-dev__pytest",
  "commit": "5dfd4eab7d328266fb3788dcbb031c9d67903daf",
  "lora_id": "setup_development_1",
  "document_id": "setup_development_1",
  "topic": "Setup and Development",
  "topic_slug": "setup_development",
  "generator": "codex_subagents_v1",
  "prompt_version": "ledger_example_question_generation_v1",
  "example_questions": [
    "What is the documented way to verify a user-level pytest installation from the command line?",
    "How does pytest use pre-commit in its contributor workflow?",
    "What does the pytest tox docs environment build, and where does it put the HTML output?",
    "When can a pytest contributor skip adding a changelog entry?",
    "How is pytest's release preparation split between the automated GitHub workflow and the manual tox-based path?"
  ]
}
