{
  "repo_id": "fogleman__Craft",
  "commit": "d6888a6e1e54340358ce25b1220f410541360b6b",
  "lora_id": "multiplayer_protocol_server_1",
  "document_id": "multiplayer_protocol_server_1",
  "topic": "Multiplayer Protocol and Server",
  "topic_slug": "multiplayer_protocol_server",
  "generator": "codex_subagents_v1",
  "prompt_version": "ledger_example_question_generation_v1",
  "example_questions": [
    "How does Craft's line-based multiplayer protocol move block, light, sign, chat, and position updates between client and server?",
    "What does client.c do with incoming socket data before main.c parses it?",
    "How does server.py validate and broadcast multiplayer block edits?",
    "What happens during Craft's multiplayer login flow when a saved identity token is present?",
    "How does parse_buffer update local players, chat, chunk redraws, and server time?"
  ]
}
