{
  "repo_id": "marimo-team__marimo",
  "commit": "979fe6a82ebfbc151de8a59461de5cfafe61db78",
  "lora_id": "apps_scripts_wasm_1",
  "document_id": "apps_scripts_wasm_1",
  "topic": "Apps, Scripts, and WebAssembly",
  "topic_slug": "apps_scripts_wasm",
  "generator": "codex_subagents_v1",
  "prompt_version": "ledger_example_question_generation_v1",
  "example_questions": [
    "How does marimo decide what an app looks like when I use marimo run?",
    "What is different between directly running a marimo notebook as Python and exporting it as a flat script?",
    "Why does a marimo HTML WASM export need to be served over HTTP?",
    "How are package and data-file expectations different for marimo WebAssembly notebooks?",
    "What does the Pyodide bridge let the browser do in an editable WASM notebook?"
  ]
}
