{
  "repo_id": "psf__requests",
  "commit": "6ec76b4a36fba4a32fb72f5f9ba04e632635e477",
  "lora_id": "sessions_redirects_state_1",
  "document_id": "sessions_redirects_state_1",
  "topic": "Sessions, Redirects, and State",
  "topic_slug": "sessions_redirects_state",
  "generator": "codex_subagents_v1",
  "prompt_version": "ledger_example_question_generation_v1",
  "example_questions": [
    "How does a Requests Session persist cookies and defaults across calls?",
    "What happens to request methods and bodies when Session follows redirects?",
    "How are response hooks attached to a Session applied to later requests?",
    "When does Requests strip Authorization while following a redirect?",
    "How does Session choose and manage mounted transport adapters?"
  ]
}
