{
  "repo_id": "psf__requests",
  "commit": "6ec76b4a36fba4a32fb72f5f9ba04e632635e477",
  "lora_id": "auth_cookies_hooks_1",
  "document_id": "auth_cookies_hooks_1",
  "topic": "Authentication, Cookies, and Hooks",
  "topic_slug": "auth_cookies_hooks",
  "generator": "codex_subagents_v1",
  "prompt_version": "ledger_example_question_generation_v1",
  "example_questions": [
    "How does Requests turn tuple credentials into Basic authentication headers?",
    "How are cookies extracted from responses and attached to later Requests calls?",
    "When can RequestsCookieJar raise a conflict for duplicate cookie names?",
    "How do session response hooks differ from per-request response hooks?",
    "How does digest authentication preserve cookies while retrying after a challenge?"
  ]
}
