{
  "repo_id": "marimo-team__marimo",
  "commit": "979fe6a82ebfbc151de8a59461de5cfafe61db78",
  "lora_id": "setup_cli_1",
  "document_id": "setup_cli_1",
  "topic": "Setup and CLI",
  "topic_slug": "setup_cli",
  "generator": "codex_subagents_v1",
  "prompt_version": "ledger_example_question_generation_v1",
  "example_questions": [
    "How does the marimo CLI use tutorials as the first install verification path?",
    "What global options does the root marimo Click group apply before dispatching subcommands?",
    "How does marimo run handle multiple notebook files or directories as an app gallery?",
    "When does marimo export watch mode require an output file?",
    "How are notebook CLI arguments passed through when running or exporting a marimo notebook?"
  ]
}
