{
  "repo_id": "psf__requests",
  "commit": "6ec76b4a36fba4a32fb72f5f9ba04e632635e477",
  "lora_id": "request_preparation_response_1",
  "document_id": "request_preparation_response_1",
  "topic": "Request Preparation and Response Objects",
  "topic_slug": "request_preparation_response",
  "generator": "codex_subagents_v1",
  "prompt_version": "ledger_example_question_generation_v1",
  "example_questions": [
    "How does Requests turn a user-created Request into a PreparedRequest before sending?",
    "What preparation order lets authentication and response hooks modify a prepared request?",
    "How are URL parameters, headers, and cookies normalized on a PreparedRequest?",
    "What Response fields connect a server reply back to redirects and the originating request?"
  ]
}
