{
  "repo_id": "marimo-team__marimo",
  "commit": "979fe6a82ebfbc151de8a59461de5cfafe61db78",
  "lora_id": "sql_data_integrations_1",
  "document_id": "sql_data_integrations_1",
  "topic": "SQL and Data Integrations",
  "topic_slug": "sql_data_integrations",
  "generator": "codex_subagents_v1",
  "prompt_version": "ledger_example_question_generation_v1",
  "example_questions": [
    "How does marimo choose the dataframe output type for SQL query results?",
    "What metadata does the Data Sources panel show for detected SQL connections?",
    "How does DuckDB table discovery populate marimo's database and schema models?",
    "How do marimo dataframe tables and charts send selected rows back into Python?",
    "How do the MotherDuck and Google data integration guides fit into marimo's Python-first data workflow?"
  ]
}
