{
  "repo_id": "pytest-dev__pytest",
  "commit": "5dfd4eab7d328266fb3788dcbb031c9d67903daf",
  "lora_id": "overview_purpose_1",
  "document_id": "overview_purpose_1",
  "topic": "Overview / Purpose",
  "topic_slug": "overview_purpose",
  "generator": "codex_subagents_v1",
  "prompt_version": "ledger_example_question_generation_v1",
  "example_questions": [
    "What is pytest's overall purpose as described by its README and package docstring?",
    "How does pytest support both small test files and larger functional test suites?",
    "What kinds of documentation sections does pytest provide for users and plugin authors?",
    "How does pytest turn configured command-line arguments into collection and test execution?",
    "Why is pytest's plugin-aware session engine central to the framework's design?"
  ]
}
