{
  "repo_id": "psf__requests",
  "commit": "6ec76b4a36fba4a32fb72f5f9ba04e632635e477",
  "lora_id": "setup_installation_1",
  "document_id": "setup_installation_1",
  "topic": "Setup and Installation",
  "topic_slug": "setup_installation",
  "generator": "codex_subagents_v1",
  "prompt_version": "ledger_example_question_generation_v1",
  "example_questions": [
    "What command does Requests document for installing the library from PyPI?",
    "How can I install Requests after cloning or downloading its source tree?",
    "What does requirements-dev.txt add for local Requests development?",
    "Which tox Python versions and variants does Requests define for testing?",
    "How is the Requests documentation build dependency pinned?"
  ]
}
