{
  "repo_id": "fogleman__Craft",
  "commit": "d6888a6e1e54340358ce25b1220f410541360b6b",
  "lora_id": "setup_build_run_1",
  "document_id": "setup_build_run_1",
  "topic": "Setup, Build, and Run",
  "topic_slug": "setup_build_run",
  "generator": "codex_subagents_v1",
  "prompt_version": "ledger_example_question_generation_v1",
  "example_questions": [
    "What source dependencies does Craft expect before running the normal CMake and make build?",
    "How do I start the Craft client locally versus connect it to a multiplayer host?",
    "What extra GCC-built artifact does the Python Craft server need for terrain generation?",
    "How does the server cleanup mode differ from starting the Craft TCP service?",
    "Where does builder.py fit into Craft's setup and server workflow?"
  ]
}
